[
  {
    "id": "9.10.010",
    "section": "9.10.010",
    "label": null,
    "heading": "Purpose",
    "article": "I",
    "text": "The purpose of this chapter is to protect public safety and the free use of public sidewalks by regulating sidewalk vending.",
    "class": "purpose",
    "attaches_to": [
      "chapter"
    ],
    "record_ids": []
  },
  {
    "id": "9.10.020.A",
    "section": "9.10.020",
    "label": "A",
    "heading": "Definitions",
    "article": "I",
    "text": "\"Applicant\" means a person who files an application for a permit under this chapter.",
    "class": "definition",
    "attaches_to": [
      "A-9.10.050.A-1",
      "A-9.10.050.C-1",
      "A-9.10.060.A-1",
      "A-9.10.060.B-1",
      "A-9.10.060.C-1",
      "A-9.10.060.C-2"
    ],
    "record_ids": []
  },
  {
    "id": "9.10.020.B",
    "section": "9.10.020",
    "label": "B",
    "heading": "Definitions",
    "article": "I",
    "text": "\"Director\" means the director of community development.",
    "class": "definition",
    "attaches_to": [
      "A-9.10.050.A-1",
      "A-9.10.050.C-1",
      "A-9.10.060.A-1",
      "A-9.10.060.B-1",
      "A-9.10.060.C-1",
      "A-9.10.070.C-1",
      "A-9.10.070.D-1",
      "A-9.10.090.A-1",
      "A-9.10.140.A-1",
      "A-9.10.140.B-1",
      "A-9.10.140.C-1"
    ],
    "record_ids": []
  },
  {
    "id": "9.10.020.C",
    "section": "9.10.020",
    "label": "C",
    "heading": "Definitions",
    "article": "I",
    "text": "\"Hearing officer\" means the city's administrative hearing officer.",
    "class": "definition",
    "attaches_to": [
      "A-9.10.130.A-1",
      "A-9.10.130.B-1",
      "A-9.10.130.C-1"
    ],
    "record_ids": []
  },
  {
    "id": "9.10.020.D",
    "section": "9.10.020",
    "label": "D",
    "heading": "Definitions",
    "article": "I",
    "text": "\"Permittee\" means a person who holds a valid permit issued under this chapter.",
    "class": "definition",
    "attaches_to": [
      "A-9.10.070.C-1",
      "A-9.10.070.D-1",
      "A-9.10.080.D-1",
      "A-9.10.140.A-1",
      "A-9.10.140.B-1",
      "A-9.10.140.C-1"
    ],
    "record_ids": []
  },
  {
    "id": "9.10.020.E",
    "section": "9.10.020",
    "label": "E",
    "heading": "Definitions",
    "article": "I",
    "text": "\"Sidewalk vendor\" means a person who sells food or merchandise from a cart on a public sidewalk.",
    "class": "definition",
    "attaches_to": [
      "A-9.10.080.A-1",
      "A-9.10.080.B-1",
      "A-9.10.080.C-1",
      "A-9.10.080.E-1",
      "A-9.10.090.B-1",
      "A-9.10.110-1",
      "A-9.10.120.B-1"
    ],
    "record_ids": []
  },
  {
    "id": "9.10.030",
    "section": "9.10.030",
    "label": null,
    "heading": "Applicability",
    "article": "I",
    "text": "This chapter does not apply to a certified farmers' market operating under Chapter 9.20.",
    "class": "applicability",
    "attaches_to": [
      "chapter"
    ],
    "record_ids": [],
    "external_refs": [
      "external:Chapter 9.20"
    ]
  },
  {
    "id": "9.10.040",
    "section": "9.10.040",
    "label": null,
    "heading": "Permit required",
    "article": "II",
    "text": "No person shall operate as a sidewalk vendor without a valid permit issued under this chapter.",
    "class": "operative",
    "attaches_to": [],
    "record_ids": [
      "A-9.10.040-1"
    ]
  },
  {
    "id": "9.10.050.A",
    "section": "9.10.050",
    "label": "A",
    "heading": "Application",
    "article": "II",
    "text": "An applicant for a sidewalk vending permit shall file a written application with the director on a form provided by the director.",
    "class": "operative",
    "attaches_to": [],
    "record_ids": [
      "A-9.10.050.A-1"
    ]
  },
  {
    "id": "9.10.050.B",
    "section": "9.10.050",
    "label": "B",
    "heading": "Application",
    "article": "II",
    "text": "The application shall be accompanied by the fee established by resolution of the council.",
    "class": "fee",
    "attaches_to": [
      "A-9.10.050.A-1"
    ],
    "record_ids": []
  },
  {
    "id": "9.10.050.C",
    "section": "9.10.050",
    "label": "C",
    "heading": "Application",
    "article": "II",
    "text": "The director shall review each application for completeness within five business days after it is filed.",
    "class": "operative",
    "attaches_to": [],
    "record_ids": [
      "A-9.10.050.C-1"
    ]
  },
  {
    "id": "9.10.050.D",
    "section": "9.10.050",
    "label": "D",
    "heading": "Application",
    "article": "II",
    "text": "A certificate of insurance shall be submitted before a permit is issued.",
    "class": "operative",
    "attaches_to": [],
    "record_ids": [
      "A-9.10.050.D-1"
    ]
  },
  {
    "id": "9.10.060.A",
    "section": "9.10.060",
    "label": "A",
    "heading": "Issuance",
    "article": "II",
    "text": "Within ten business days after an application is determined complete, the director shall issue or deny the permit.",
    "class": "operative",
    "attaches_to": [],
    "record_ids": [
      "A-9.10.060.A-1"
    ]
  },
  {
    "id": "9.10.060.B",
    "section": "9.10.060",
    "label": "B",
    "heading": "Issuance",
    "article": "II",
    "text": "The director shall deny the permit if the applicant has an unpaid fine under this chapter.",
    "class": "operative",
    "attaches_to": [],
    "record_ids": [
      "A-9.10.060.B-1"
    ]
  },
  {
    "id": "9.10.060.C",
    "section": "9.10.060",
    "label": "C",
    "heading": "Issuance",
    "article": "II",
    "text": "The director or the director's designee shall notify the applicant of a denial in writing, stating the reasons.",
    "class": "operative",
    "attaches_to": [],
    "record_ids": [
      "A-9.10.060.C-1",
      "A-9.10.060.C-2"
    ]
  },
  {
    "id": "9.10.070.A",
    "section": "9.10.070",
    "label": "A",
    "heading": "Term and renewal",
    "article": "II",
    "text": "A permit shall expire one year after the date of issuance.",
    "class": "applicability",
    "attaches_to": [
      "A-9.10.060.A-1",
      "A-9.10.070.C-1"
    ],
    "record_ids": []
  },
  {
    "id": "9.10.070.B",
    "section": "9.10.070",
    "label": "B",
    "heading": "Term and renewal",
    "article": "II",
    "text": "The permittee shall renew the permit annually.",
    "class": "operative",
    "attaches_to": [],
    "record_ids": [
      "A-9.10.070.B-1"
    ]
  },
  {
    "id": "9.10.070.C",
    "section": "9.10.070",
    "label": "C",
    "heading": "Term and renewal",
    "article": "II",
    "text": "A permittee shall file a renewal application with the director at least thirty days before the permit expires.",
    "class": "operative",
    "attaches_to": [],
    "record_ids": [
      "A-9.10.070.C-1"
    ]
  },
  {
    "id": "9.10.070.D",
    "section": "9.10.070",
    "label": "D",
    "heading": "Term and renewal",
    "article": "II",
    "text": "The director shall act on a renewal application in the manner provided in Section 9.10.060.",
    "class": "operative",
    "attaches_to": [],
    "record_ids": [
      "A-9.10.070.D-1"
    ]
  },
  {
    "id": "9.10.080.A",
    "section": "9.10.080",
    "label": "A",
    "heading": "Operating requirements",
    "article": "III",
    "text": "A sidewalk vendor shall display the permit in a conspicuous place on the vending cart at all times while vending.",
    "class": "operative",
    "attaches_to": [],
    "record_ids": [
      "A-9.10.080.A-1"
    ]
  },
  {
    "id": "9.10.080.B",
    "section": "9.10.080",
    "label": "B",
    "heading": "Operating requirements",
    "article": "III",
    "text": "No sidewalk vendor shall vend within one hundred feet of an elementary school entrance during school hours.",
    "class": "operative",
    "attaches_to": [],
    "record_ids": [
      "A-9.10.080.B-1"
    ]
  },
  {
    "id": "9.10.080.C",
    "section": "9.10.080",
    "label": "C",
    "heading": "Operating requirements",
    "article": "III",
    "text": "Each vendor shall ensure compliance with all applicable health regulations.",
    "class": "operative",
    "attaches_to": [],
    "record_ids": [
      "A-9.10.080.C-1"
    ]
  },
  {
    "id": "9.10.080.D",
    "section": "9.10.080",
    "label": "D",
    "heading": "Operating requirements",
    "article": "III",
    "text": "A permittee may operate between the hours of 7:00 a.m. and 9:00 p.m.",
    "class": "operative",
    "attaches_to": [],
    "record_ids": [
      "A-9.10.080.D-1"
    ]
  },
  {
    "id": "9.10.080.E",
    "section": "9.10.080",
    "label": "E",
    "heading": "Operating requirements",
    "article": "III",
    "text": "No vending cart shall exceed four feet in width.",
    "class": "operative",
    "attaches_to": [],
    "record_ids": [
      "A-9.10.080.E-1"
    ]
  },
  {
    "id": "9.10.090.A",
    "section": "9.10.090",
    "label": "A",
    "heading": "Prohibited streets",
    "article": "III",
    "text": "The director may, by written order, designate streets on which sidewalk vending is prohibited.",
    "class": "operative",
    "attaches_to": [],
    "record_ids": [
      "A-9.10.090.A-1"
    ]
  },
  {
    "id": "9.10.090.B",
    "section": "9.10.090",
    "label": "B",
    "heading": "Prohibited streets",
    "article": "III",
    "text": "No sidewalk vendor shall vend on a street designated under subsection A.",
    "class": "operative",
    "attaches_to": [],
    "record_ids": [
      "A-9.10.090.B-1"
    ]
  },
  {
    "id": "9.10.100",
    "section": "9.10.100",
    "label": null,
    "heading": "Cart dimensions",
    "article": "III",
    "text": "Vending carts shall not exceed five feet in width.",
    "class": "operative",
    "attaches_to": [],
    "record_ids": [
      "A-9.10.100-1"
    ]
  },
  {
    "id": "9.10.110",
    "section": "9.10.110",
    "label": null,
    "heading": "Food vendors",
    "article": "III",